{
  "protocol_version": "telephone-line-batch-v1",
  "batch_id": "bbbbbbbb-cccc-dddd-eeee-ffffffffffff",
  "lead_session_id": "example-session-001",
  "lead_worktree": "C:\\example\\worktree",
  "lead_identity_sha256": "e3b0c44298fc1c149afbf4c8996fb92427ae41e4649b934ca495991b7852b855",
  "n": 2,
  "counted": 2,
  "closed": true,
  "acceptance_eligible": true,
  "package_ids": ["pkg-success", "pkg-execution-failure"],
  "items": [
    {
      "package_id": "pkg-success",
      "line_job_id": "aaaaaaaa-bbbb-cccc-dddd-eeeeeeeeeee1",
      "sequence": 1,
      "classification": "success",
      "lead_session_id": "example-session-001",
      "lead_worktree": "C:\\example\\worktree",
      "lead_launcher_path": "C:\\example\\lead-launcher.ps1",
      "lead_identity_sha256": "e3b0c44298fc1c149afbf4c8996fb92427ae41e4649b934ca495991b7852b855",
      "profile": {
        "path": "C:\\example\\profile.json",
        "bytes": 12,
        "sha256": "e3b0c44298fc1c149afbf4c8996fb92427ae41e4649b934ca495991b7852b855"
      },
      "dispatch": {
        "path": "C:\\example\\jobs\\aaaaaaaa-bbbb-cccc-dddd-eeeeeeeeeee1\\dispatch.json",
        "bytes": 12,
        "sha256": "e3b0c44298fc1c149afbf4c8996fb92427ae41e4649b934ca495991b7852b855"
      },
      "receipt": {
        "path": "C:\\example\\jobs\\aaaaaaaa-bbbb-cccc-dddd-eeeeeeeeeee1\\receipt.json",
        "bytes": 12,
        "sha256": "e3b0c44298fc1c149afbf4c8996fb92427ae41e4649b934ca495991b7852b855"
      }
    },
    {
      "package_id": "pkg-execution-failure",
      "line_job_id": "aaaaaaaa-bbbb-cccc-dddd-eeeeeeeeeee2",
      "sequence": 2,
      "classification": "execution_failure",
      "lead_session_id": "example-session-001",
      "lead_worktree": "C:\\example\\worktree",
      "lead_launcher_path": "C:\\example\\lead-launcher.ps1",
      "lead_identity_sha256": "e3b0c44298fc1c149afbf4c8996fb92427ae41e4649b934ca495991b7852b855",
      "profile": {
        "path": "C:\\example\\profile.json",
        "bytes": 12,
        "sha256": "e3b0c44298fc1c149afbf4c8996fb92427ae41e4649b934ca495991b7852b855"
      },
      "dispatch": {
        "path": "C:\\example\\jobs\\aaaaaaaa-bbbb-cccc-dddd-eeeeeeeeeee2\\dispatch.json",
        "bytes": 12,
        "sha256": "e3b0c44298fc1c149afbf4c8996fb92427ae41e4649b934ca495991b7852b855"
      },
      "receipt": {
        "path": "C:\\example\\jobs\\aaaaaaaa-bbbb-cccc-dddd-eeeeeeeeeee2\\receipt.json",
        "bytes": 12,
        "sha256": "e3b0c44298fc1c149afbf4c8996fb92427ae41e4649b934ca495991b7852b855"
      }
    }
  ],
  "wake_run_id": "telephone-batch-bbbbbbbb-cccc-dddd-eeee-ffffffffffff",
  "wake_key": "e3b0c44298fc1c149afbf4c8996fb92427ae41e4649b934ca495991b7852b855",
  "retry_of": null,
  "implicit": false,
  "created_at_utc": "2026-01-01T00:00:00.0000000+00:00"
}
